slug,title_ar,title_en,description_ar,description_en,portal,portal_url,ministry_ar,ministry_en,category_ar,category_en,tags,penalty_ar,penalty_en,related_slugs,last_updated
absher-account-registration,تسجيل وتفعيل حساب أبشر,Register and activate Absher account,أبشر هي البوابة الإلكترونية لخدمات وزارة الداخلية. هذا الدليل يشرح كيفية إنشاء حساب جديد وتفعيله خطوة بخطوة.,Absher is the official portal for Ministry of Interior services. This guide explains how to create and activate a new account step by step.,أبشر,https://www.absher.sa,وزارة الداخلية,Ministry of Interior,خدمات عامة,General Services,"أبشر|info, مطلوب لكل الخدمات|warning, آخر تحديث: مارس 2026|warning",,,"register-national-address, renew-iqama",########
check-iqama-validity,الاستعلام عن صلاحية الإقامة عبر أبشر,Check Iqama validity via Absher,تتيح لك هذه الخدمة التحقق من تاريخ انتهاء إقامتك أو إقامة أحد مكفوليك إلكترونياً عبر أبشر، لتجنب الغرامات والتأخير.,"This service allows you to check the expiry date of your Iqama or your dependents' Iqama online via Absher, to avoid fines and delays.",أبشر أفراد,https://www.absher.sa,وزارة الداخلية,Ministry of Interior,خدمات الجوازات,Passport Services,"أبشر أفراد|info, استعلام فوري|success, آخر تحديث: مارس 2026|warning",,,"renew-iqama, dependents-fee-payment, exit-reentry-visa",########
check-traffic-violations,الاستعلام عن المخالفات المرورية برقم الهوية,Check traffic violations by ID number,تتيح لك هذه الخدمة الاستعلام عن جميع المخالفات المرورية المسجلة عليك أو على مركباتك، مع تفاصيل كل مخالفة وحالة السداد.,"This service allows you to check all traffic violations registered against you or your vehicles, with details of each violation and payment status.",أبشر أفراد / تطبيق المرور,https://www.absher.sa,وزارة الداخلية,Ministry of Interior,خدمات المرور,Traffic Services,"أبشر / تطبيق المرور|info, استعلام فوري|success, آخر تحديث: مارس 2026|warning",,,"pay-traffic-fines, traffic-violation-objection, renew-driving-license",########
convert-visit-to-iqama,تحويل تأشيرة زيارة إلى إقامة,Convert visit visa to Iqama (residence permit),في بعض الحالات يمكن تحويل تأشيرة الزيارة إلى إقامة عمل أو إقامة مرافق دون الحاجة لمغادرة المملكة والعودة.,"In some cases, a visit visa can be converted to a work residence or dependent residence without leaving the Kingdom and returning.",أبشر أعمال / قوى,https://www.absher.sa,وزارة الداخلية / وزارة الموارد البشرية,Ministry of Interior / HRSD,خدمات الجوازات,Passport Services,"أبشر أعمال / قوى|info, شروط محددة|warning, آخر تحديث: مارس 2026|warning",,,"renew-iqama, family-visit-visa, exit-reentry-visa",########
dependents-fee-payment,سداد رسوم المرافقين والتابعين,Pay dependent and companion fees,تُفرض رسوم شهرية على المرافقين والتابعين للمقيمين في المملكة. يمكن سدادها عبر أبشر أو القنوات البنكية.,Monthly fees are imposed on dependents and companions of residents in the Kingdom. They can be paid via Absher or banking channels.,أبشر أفراد / البنوك,https://www.absher.sa,وزارة الداخلية,Ministry of Interior,خدمات الجوازات,Passport Services,"أبشر / سداد|info, رسوم شهرية|warning, آخر تحديث: مارس 2026|warning",عدم السداد يمنع تجديد الإقامة وإصدار التأشيرات,Non-payment prevents Iqama renewal and visa issuance,"renew-iqama, exit-reentry-visa",########
ejar-rental-contract,توثيق عقد إيجار إلكتروني عبر إيجار,Register rental contract via Ejar,يجب توثيق جميع عقود الإيجار السكنية والتجارية إلكترونياً عبر منصة إيجار. العقد الموثق مطلوب لإصدار رخص البلدية وفتح حسابات الخدمات.,All residential and commercial rental contracts must be registered electronically via the Ejar platform. A registered contract is required for municipal licenses and utility account setup.,منصة إيجار,https://www.ejar.sa,وزارة الشؤون البلدية والقروية والإسكان,"Ministry of Municipal, Rural Affairs and Housing",خدمات الإسكان,Housing Services,"منصة إيجار|info, إلزامي لكل عقد إيجار|warning, آخر تحديث: مارس 2026|warning",عقود الإيجار غير الموثقة لا تُقبل في المحاكم ولا تُستخدم لإصدار التراخيص,Unregistered rental contracts are not accepted in courts and cannot be used for license issuance,"issue-municipal-license, register-national-address",########
electricity-connection-sec,طلب إيصال كهرباء عبر الشركة السعودية للكهرباء,Request electricity connection via SEC,تتيح هذه الخدمة طلب إيصال التيار الكهربائي لعقار جديد أو نقل الحساب إلكترونياً عبر تطبيق أو موقع الشركة السعودية للكهرباء.,This service allows you to request electricity connection for a new property or transfer an account electronically via the Saudi Electricity Company app or website.,الشركة السعودية للكهرباء (SEC),https://www.se.com.sa,الشركة السعودية للكهرباء,Saudi Electricity Company (SEC),خدمات الإسكان,Housing Services,خدمة إلكترونية|info,,,"ejar-rental-contract, sakani-housing-support",2026-03-18
exit-reentry-visa,إصدار تأشيرة خروج وعودة عبر أبشر,Issue exit/re-entry visa via Absher,تتيح لك هذه الخدمة إصدار تأشيرة خروج وعودة لأحد المكفولين أو العمالة المنزلية إلكترونياً، مما يمكّنهم من السفر خارج المملكة والعودة خلال فترة محددة.,"This service allows you to issue an exit-reentry visa for a sponsored person or domestic worker electronically, enabling them to travel outside the Kingdom and return within a specified period.",أبشر أفراد,https://www.absher.sa,وزارة الداخلية,Ministry of Interior,خدمات الجوازات,Passport Services,"أبشر أفراد|info, إلكترونية بالكامل|success, آخر تحديث: مارس 2026|warning",عدم العودة خلال مدة التأشيرة قد يؤدي لإلغاء الإقامة,Failure to return within the visa period may result in Iqama cancellation,"renew-iqama, final-exit-visa, renew-passport-expat",########
extend-visit-visa,تمديد تأشيرة الزيارة عبر أبشر,Extend visit visa via Absher,تتيح هذه الخدمة للكفيل تمديد تأشيرة الزيارة العائلية أو الشخصية إلكترونياً عبر أبشر قبل انتهاء صلاحيتها.,This service allows the sponsor to extend a family or personal visit visa electronically via Absher before it expires.,أبشر أفراد,https://www.absher.sa,وزارة الداخلية,Ministry of Interior,خدمات التأشيرات,Visa Services,يجب التمديد قبل الانتهاء|warning,,,"family-visit-visa, convert-visit-to-iqama",2026-03-18
family-visit-visa,إصدار تأشيرة زيارة عائلية عبر وزارة الخارجية,Issue family visit visa via MOFA,تتيح لك هذه الخدمة تقديم طلب تأشيرة زيارة عائلية لاستقدام أفراد عائلتك من خارج المملكة لزيارة مؤقتة.,This service allows you to apply for a family visit visa to bring your family members from outside the Kingdom for a temporary visit.,منصة التأشيرات الإلكترونية,https://visa.mofa.gov.sa,وزارة الخارجية,Ministry of Foreign Affairs,خدمات التأشيرات,Visa Services,"وزارة الخارجية|info, للمقيمين والمواطنين|success, آخر تحديث: مارس 2026|warning",عدم مغادرة الزائر قبل انتهاء التأشيرة يعرّض الكفيل لغرامة ومنع من إصدار تأشيرات مستقبلية,"If the visitor does not leave before the visa expires, the sponsor faces a fine and a ban on future visa issuance","exit-reentry-visa, renew-iqama",########
final-exit-visa,إصدار تأشيرة خروج نهائي عبر أبشر,Issue final exit visa via Absher,تمكّن هذه الخدمة صاحب العمل من إصدار تأشيرة خروج نهائي لأحد العاملين لديه، وذلك لمغادرة المملكة بشكل نهائي بعد انتهاء العلاقة العمالية.,This service enables employers to issue a final exit visa for an employee to leave the Kingdom permanently after the employment relationship ends.,أبشر أعمال,https://www.absher.sa,وزارة الداخلية,Ministry of Interior,خدمات الجوازات,Passport Services,"أبشر أعمال|info, إلكترونية بالكامل|success, آخر تحديث: مارس 2026|warning",,,"renew-iqama, exit-reentry-visa, transfer-sponsorship",########
foreign-degree-equivalency,معادلة الشهادات الأجنبية,Foreign degree equivalency,تتيح هذه الخدمة معادلة الشهادات الجامعية الصادرة من خارج المملكة لاعتمادها في التوظيف والدراسات العليا عبر وزارة التعليم.,This service allows the equivalency of university degrees issued from outside the Kingdom for use in employment and postgraduate studies via the Ministry of Education.,وزارة التعليم,https://rue.moe.gov.sa,وزارة التعليم,Ministry of Education,خدمات تعليمية,Education Services,مطلوبة للتوظيف الحكومي|warning,,,"university-admission, jadarat-job-search",2026-03-18
freelance-permit,إصدار وثيقة العمل الحر,Issue freelance work permit,وثيقة العمل الحر تتيح للمواطنين السعوديين ممارسة أعمال حرة بشكل رسمي دون الحاجة لسجل تجاري. تشمل أكثر من 140 نشاطاً في مختلف المجالات.,The freelance work permit allows Saudi citizens to practice freelance work officially without a commercial registration. It covers over 140 activities across various fields.,منصة العمل الحر,https://freelance.sa,وزارة الموارد البشرية,Ministry of Human Resources,خدمات مالية,Financial Services,"للمواطنين السعوديين فقط|info, بديل عن السجل التجاري|success",,,"issue-commercial-registration, zatca-vat-registration",2026-03-18
gosi-certificate,إصدار شهادة التأمينات الاجتماعية,Issue GOSI subscription certificate,شهادة التأمينات مطلوبة في كثير من المعاملات الحكومية والبنكية. يمكن إصدارها إلكترونياً عبر بوابة التأمينات أون لاين.,The GOSI certificate is required for many government and banking transactions. It can be issued electronically via the GOSI Online portal.,التأمينات أون لاين,https://www.gosi.gov.sa,المؤسسة العامة للتأمينات الاجتماعية,General Organization for Social Insurance (GOSI),خدمات التأمينات,Insurance Services,"التأمينات أون لاين|info, إلكترونية بالكامل|success, آخر تحديث: مارس 2026|warning",,,"gosi-register-employee, gosi-retirement-subscription",########
gosi-register-employee,تسجيل موظف في التأمينات الاجتماعية عبر أعمال,Register employee in GOSI via Amaal,تتيح هذه الخدمة لأصحاب المنشآت تسجيل موظفيهم الجدد (سعوديين ووافدين) في نظام التأمينات الاجتماعية إلكترونياً عبر بوابة أعمال.,This service allows business owners to register their new employees (Saudi and non-Saudi) in the social insurance system electronically via the GOSI Amaal portal.,التأمينات أعمال,https://www.gosi.gov.sa,المؤسسة العامة للتأمينات الاجتماعية,General Organization for Social Insurance (GOSI),خدمات التأمينات,Social Insurance Services,"التأمينات أعمال|info, إلزامي لكل موظف|warning, آخر تحديث: مارس 2026|warning","التأخر في التسجيل يعرّض المنشأة لغرامات تصل إلى 10,000 ر.س وقد يؤثر على نطاقات","Late registration exposes the establishment to fines up to SAR 10,000 and may affect Nitaqat rating","renew-work-permit, transfer-sponsorship",########
gosi-retirement-subscription,الاستعلام عن مدة الاشتراك في التأمينات,Check GOSI subscription period,تتيح لك هذه الخدمة معرفة مدة اشتراكك في التأمينات الاجتماعية والتحقق من تسجيل جهة عملك لك بشكل صحيح.,This service allows you to check your social insurance subscription period and verify that your employer has registered you correctly.,التأمينات أون لاين,https://www.gosi.gov.sa,المؤسسة العامة للتأمينات الاجتماعية,General Organization for Social Insurance (GOSI),خدمات التأمينات,Insurance Services,"التأمينات أون لاين|info, للموظفين|success, آخر تحديث: مارس 2026|warning",,,gosi-register-employee,########
hajj-umrah-permit,إصدار تصريح حج أو عمرة عبر نسك,Issue Hajj or Umrah permit via Nusuk,تتيح منصة نسك للمواطنين والمقيمين إصدار تصاريح الحج والعمرة وحجز الخدمات المرتبطة بها إلكترونياً.,The Nusuk platform allows citizens and residents to issue Hajj and Umrah permits and book related services electronically.,منصة نسك,https://www.nusuk.sa,وزارة الحج والعمرة,Ministry of Hajj and Umrah,خدمات الحج والعمرة,Hajj & Umrah Services,"منصة نسك|info, تصريح مطلوب|warning, آخر تحديث: مارس 2026|warning",,,"nafath-setup, absher-account-registration",########
issue-birth-certificate,تسجيل مولود وإصدار شهادة ميلاد,Register newborn and issue birth certificate,تتيح هذه الخدمة تسجيل المواليد الجدد وإصدار شهادة الميلاد إلكترونياً عبر أبشر خلال 15 يوماً من الولادة.,This service allows you to register newborns and issue a birth certificate electronically via Absher within 15 days of birth.,أبشر أفراد,https://www.absher.sa,وزارة الداخلية,Ministry of Interior,خدمات الأحوال المدنية,Civil Affairs,"أبشر أفراد|info, خلال 15 يوم من الولادة|warning, آخر تحديث: مارس 2026|warning",التأخر عن 15 يوماً يتطلب مراجعة الأحوال المدنية شخصياً,Delay beyond 15 days requires an in-person visit to Civil Affairs,"renew-national-id, absher-account-registration",########
issue-commercial-registration,إصدار سجل تجاري عبر المركز السعودي للأعمال,Issue commercial registration via Saudi Business Center,تتيح لك هذه الخدمة إصدار سجل تجاري رئيسي أو فرعي لمنشأتك إلكترونياً عبر المركز السعودي للأعمال، وهي الخطوة الأولى لبدء أي نشاط تجاري في المملكة.,This service allows you to issue a main or branch commercial registration for your business electronically via the Saudi Business Center — the first step to starting any business in the Kingdom.,المركز السعودي للأعمال,https://business.sa,وزارة التجارة,Ministry of Commerce,خدمات تجارية,Business Services,"المركز السعودي للأعمال|info, إلكترونية بالكامل|success, آخر تحديث: مارس 2026|warning",عدم تجديد السجل خلال 30 يوماً من انتهائه يعرّض المنشأة لغرامة وشطب,Failure to renew within 30 days of expiry exposes the business to fines and deregistration,"renew-commercial-registration, issue-municipal-license",########
issue-family-card,إصدار بطاقة العائلة (كرت العائلة) عبر أبشر,Issue family card via Absher,بطاقة العائلة وثيقة رسمية تثبت أفراد الأسرة وعلاقتهم. مطلوبة في كثير من المعاملات الحكومية والتعليمية والصحية.,"The family card is an official document that certifies family members and their relationships. It is required for many government, educational, and health transactions.",أبشر أفراد,https://www.absher.sa,وزارة الداخلية,Ministry of Interior,خدمات الأحوال المدنية,Civil Affairs,"أبشر أفراد|info, للمواطنين فقط|warning, آخر تحديث: مارس 2026|warning",,,"issue-birth-certificate, marriage-contract-najiz, renew-national-id",########
issue-municipal-license,إصدار رخصة بلدية (رخصة نشاط) عبر بلدي,Issue municipal license via Balady,الرخصة البلدية مطلوبة لمزاولة أي نشاط تجاري في موقع فعلي. تتيح منصة بلدي إصدارها إلكترونياً.,A municipal license is required to operate any business at a physical location. The Balady platform allows electronic issuance.,منصة بلدي,https://balady.gov.sa,وزارة الشؤون البلدية والقروية والإسكان,"Ministry of Municipal, Rural Affairs and Housing",خدمات تجارية,Business Services,"منصة بلدي|info, مطلوبة لكل موقع تجاري|warning, آخر تحديث: مارس 2026|warning",مزاولة نشاط بدون رخصة بلدية تعرّض المنشأة لغرامة وإغلاق,Operating without a municipal license exposes the business to fines and closure,"issue-commercial-registration, renew-commercial-registration",########
jadarat-job-search,البحث عن وظيفة عبر منصة جدارات,Search for jobs via Jadarat platform,جدارات هي المنصة الوطنية للتوظيف التي تربط الباحثين عن عمل بفرص القطاعين العام والخاص، وتحل محل منصتي طاقات وجدارة.,"Jadarat is the national employment platform connecting job seekers with public and private sector opportunities, replacing the former Taqat and Jadara platforms.",منصة جدارات,https://www.jadarat.sa,وزارة الموارد البشرية والتنمية الاجتماعية,Ministry of Human Resources and Social Development,خدمات العمل,Labor Services,"منصة جدارات|info, للباحثين عن عمل|success, آخر تحديث: مارس 2026|warning",,,"gosi-retirement-subscription, renew-national-id",########
labor-complaint-qiwa,تقديم شكوى عمالية عبر قوى,File labor complaint via Qiwa,تتيح هذه الخدمة للعاملين تقديم شكوى ضد صاحب العمل في حالات مثل: تأخر الرواتب، عدم توفير بيئة عمل آمنة، أو مخالفة شروط العقد.,"This service allows workers to file a complaint against their employer in cases such as: delayed salary, unsafe work environment, or contract violations.",منصة قوى,https://www.qiwa.sa,وزارة الموارد البشرية والتنمية الاجتماعية,Ministry of Human Resources and Social Development,خدمات العمل,Labor Services,"منصة قوى|info, للعاملين|success, آخر تحديث: مارس 2026|warning",,,"transfer-sponsorship, renew-work-permit",########
maroof-ecommerce,توثيق متجر إلكتروني عبر معروف,Certify online store via Maroof,منصة معروف تتيح لأصحاب المتاجر الإلكترونية توثيق أعمالهم وبناء ثقة مع العملاء. التوثيق مطلوب للإعلان في بعض المنصات.,The Maroof platform allows online store owners to certify their businesses and build customer trust. Certification is required for advertising on some platforms.,منصة معروف,https://maroof.sa,وزارة التجارة,Ministry of Commerce,خدمات مالية,Financial Services,مطلوب للإعلانات الإلكترونية|warning,,,"issue-commercial-registration, freelance-permit",2026-03-18
marriage-contract-najiz,توثيق عقد زواج عبر ناجز,Authenticate marriage contract via Najiz,تتيح هذه الخدمة توثيق عقد الزواج إلكترونياً عبر بوابة ناجز التابعة لوزارة العدل، دون الحاجة لزيارة المحكمة.,"This service allows electronic registration of marriage contracts via the Najiz portal of the Ministry of Justice, without the need to visit the court.",بوابة ناجز,https://www.najiz.sa,وزارة العدل,Ministry of Justice,خدمات الأحوال المدنية,Civil Affairs,"بوابة ناجز|info, إلكترونية بالكامل|success, آخر تحديث: مارس 2026|warning",,,"issue-birth-certificate, renew-national-id",########
medical-exam-iqama,الفحص الطبي للإقامة ورخصة القيادة,Medical exam for Iqama and driving license,الفحص الطبي مطلوب لإصدار أو تجديد الإقامة ولإصدار أو تجديد رخصة القيادة. يتم في المستشفيات والمستوصفات المعتمدة وتُرسل النتائج إلكترونياً.,"A medical exam is required for Iqama issuance/renewal and driving license issuance/renewal. It is done at approved hospitals and clinics, and results are sent electronically.",المستشفيات والمستوصفات المعتمدة,https://www.moh.gov.sa,وزارة الصحة,Ministry of Health,خدمات صحية,Health Services,مطلوب لتجديد الإقامة والرخصة|warning,,,"renew-iqama, renew-driving-license",2026-03-18
musaned-domestic-worker-visa,استقدام عمالة منزلية عبر مساند,Recruit domestic worker via Musaned,تتيح منصة مساند لأصحاب العمل استقدام العمالة المنزلية (سائقين، خادمات، مربيات، طباخين) من خارج المملكة بشكل إلكتروني.,"The Musaned platform allows employers to recruit domestic workers (drivers, maids, nannies, cooks) from outside the Kingdom electronically.",منصة مساند,https://www.musaned.com.sa,وزارة الموارد البشرية والتنمية الاجتماعية,Ministry of Human Resources and Social Development,خدمات العمالة المنزلية,Domestic Worker Services,"منصة مساند|info, للمواطنين والمقيمين|success, آخر تحديث: مارس 2026|warning",,,"renew-iqama, transfer-sponsorship",########
musaned-transfer-domestic-worker,نقل خدمات عمالة منزلية عبر مساند,Transfer domestic worker via Musaned,تتيح هذه الخدمة نقل خدمات عامل منزلي من كفيل إلى آخر إلكترونياً عبر منصة مساند.,This service allows the transfer of domestic worker services from one sponsor to another electronically via the Musaned platform.,منصة مساند,https://www.musaned.com.sa,وزارة الموارد البشرية والتنمية الاجتماعية,Ministry of Human Resources and Social Development,خدمات العمالة المنزلية,Domestic Worker Services,"منصة مساند|info, موافقة الطرفين مطلوبة|warning, آخر تحديث: مارس 2026|warning",,,"musaned-domestic-worker-visa, renew-iqama",########
nafath-setup,تفعيل تطبيق نفاذ الوطني,Set up Nafath national digital ID,نفاذ هو نظام الهوية الرقمية الوطني المطلوب لتسجيل الدخول إلى معظم المنصات الحكومية والبنكية. هذا الدليل يشرح التفعيل خطوة بخطوة.,Nafath is the national digital identity system required to log in to most government and banking platforms. This guide explains activation step by step.,تطبيق نفاذ,https://www.iam.gov.sa,هيئة الحكومة الرقمية,Digital Government Authority,خدمات عامة,General Services,"تطبيق نفاذ|info, مطلوب لكل المنصات|warning, آخر تحديث: مارس 2026|warning",,,"absher-account-registration, register-national-address",########
