slug,title_ar,title_en,description_ar,portal,portal_url,ministry_ar,ministry_en,category_ar,category_en,tags,penalty_ar,related_slugs,last_updated
replacement-national-id,إصدار بدل فاقد أو تالف للهوية الوطنية عبر أبشر,Issue replacement national ID (lost or damaged) via Absher,تتيح لك هذه الخدمة إصدار بطاقة هوية وطنية بدل فاقد أو تالف إلكترونياً عبر أبشر، مع إمكانية توصيلها لعنوانك الوطني.,أبشر أفراد,https://www.absher.sa,وزارة الداخلية,Ministry of Interior,خدمات الأحوال المدنية,Civil Affairs,"أبشر أفراد|info, للمواطنين فقط|warning, آخر تحديث: مارس 2026|warning",غرامة فقدان الهوية قد تصل إلى 100 ر.س في حال التكرار,"renew-national-id, absher-account-registration",2026-03-18
report-absconding-musaned,تقديم بلاغ تغيب عمالة منزلية عبر مساند,Report absconding domestic worker via Musaned,تتيح هذه الخدمة لصاحب العمل تقديم بلاغ تغيب على عامل منزلي ترك العمل بدون سبب مشروع.,منصة مساند,https://www.musaned.com.sa,وزارة الموارد البشرية والتنمية الاجتماعية,Ministry of Human Resources and Social Development,خدمات العمالة المنزلية,Domestic Worker Services,"منصة مساند|info, خلال 15 يوم من التغيب|warning, آخر تحديث: مارس 2026|warning",,"musaned-domestic-worker-visa, musaned-transfer-domestic-worker",2026-03-18
road-issue-report,بلاغ عن مشكلة في الطريق عبر تطبيق بلاغ,Report road issue via Balagh app,تتيح هذه الخدمة الإبلاغ عن مشاكل الطرق (حفر، إضاءة معطلة، لوحات مفقودة، حواجز تالفة) عبر تطبيق بلاغ التابع لوزارة النقل.,تطبيق بلاغ,https://www.mot.gov.sa,وزارة النقل والخدمات اللوجستية,Ministry of Transport and Logistic Services,خدمات عامة,General Services,"تطبيق بلاغ|info, مجاني للجميع|success, آخر تحديث: مارس 2026|warning",,"absher-account-registration, tawakkalna-setup",2026-03-18
saned-unemployment,التقديم على إعانة ساند (التعطل عن العمل),Apply for SANED unemployment benefit,نظام ساند يوفر تعويضاً شهرياً للمواطنين السعوديين الذين فقدوا وظائفهم لأسباب خارجة عن إرادتهم، لمدة تصل إلى 12 شهراً.,التأمينات أون لاين,https://www.gosi.gov.sa,المؤسسة العامة للتأمينات الاجتماعية,General Organization for Social Insurance (GOSI),خدمات التأمينات,Insurance Services,"التأمينات أون لاين|info, للسعوديين فقط|warning, آخر تحديث: مارس 2026|warning",,"gosi-certificate, jadarat-job-search",2026-03-18
saudi-business-visa,إصدار تأشيرة عمل (استقدام) عبر قوى,Issue work visa via Qiwa,تتيح هذه الخدمة لأصحاب المنشآت إصدار تأشيرة عمل لاستقدام عمالة من خارج المملكة عبر منصة قوى.,منصة قوى,https://www.qiwa.sa,وزارة الموارد البشرية والتنمية الاجتماعية,Ministry of Human Resources and Social Development,خدمات العمل,Labor Services,"منصة قوى|info, للمنشآت فقط|warning, آخر تحديث: مارس 2026|warning",,"renew-work-permit, transfer-sponsorship",2026-03-18
school-enrollment,تسجيل طالب في المدارس الحكومية عبر نظام نور,Enroll student in public school via Noor,تتيح هذه الخدمة لولي الأمر تسجيل أبنائه في المدارس الحكومية (ابتدائي، متوسط، ثانوي) عبر نظام نور الإلكتروني.,نظام نور,https://noor.moe.gov.sa,وزارة التعليم,Ministry of Education,خدمات تعليمية,Education Services,"نظام نور|info, فترات تسجيل محددة|warning, آخر تحديث: مارس 2026|warning",,"absher-account-registration, nafath-setup",2026-03-18
simah-credit-report,طلب تقرير سمة الائتماني,Request SIMAH credit report,تقرير سمة يوضح سجلك الائتماني لدى البنوك وشركات التمويل. مطلوب عند التقديم على قرض أو بطاقة ائتمانية أو تمويل عقاري.,سمة الائتمانية,https://www.simah.com,الشركة السعودية للمعلومات الائتمانية (سمة),Saudi Credit Bureau (SIMAH),خدمات مالية,Financial Services,"سمة الائتمانية|info, تقرير مجاني مرة سنوياً|success, آخر تحديث: مارس 2026|warning",,"absher-account-registration, nafath-setup",2026-03-18
tawakkalna-setup,التسجيل وتفعيل تطبيق توكلنا خدمات,Set up Tawakkalna Services app,توكلنا هو التطبيق الحكومي الشامل الذي يوفر أكثر من 600 خدمة حكومية، بما في ذلك الهوية الرقمية ورخصة القيادة الرقمية وتصاريح الحج والعمرة.,تطبيق توكلنا,https://ta.sdaia.gov.sa,الهيئة السعودية للبيانات والذكاء الاصطناعي,Saudi Data and AI Authority (SDAIA),خدمات عامة,General Services,"تطبيق توكلنا|info, 600+ خدمة حكومية|success, آخر تحديث: مارس 2026|warning",,"nafath-setup, absher-account-registration",2026-03-18
traffic-violation-objection,الاعتراض على مخالفة مرورية عبر أبشر,Object to traffic violation via Absher,تتيح هذه الخدمة الاعتراض على مخالفة مرورية مسجلة إذا كنت تعتقد أنها غير صحيحة، خلال 30 يوماً من تاريخ تسجيلها.,أبشر أفراد,https://www.absher.sa,وزارة الداخلية,Ministry of Interior,خدمات المرور,Traffic Services,"أبشر أفراد|info, خلال 30 يوم من المخالفة|warning, آخر تحديث: مارس 2026|warning",,"pay-traffic-fines, renew-driving-license",2026-03-18
transfer-sponsorship,نقل خدمات عامل (نقل كفالة) عبر قوى,Transfer worker sponsorship via Qiwa,تتيح هذه الخدمة لأصحاب العمل نقل خدمات عامل من منشأة إلى أخرى إلكترونياً عبر منصة قوى، وذلك وفق ضوابط نظام العمل المحدّثة.,منصة قوى,https://www.qiwa.sa,وزارة الموارد البشرية والتنمية الاجتماعية,Ministry of Human Resources and Social Development,خدمات العمل,Labor Services,"منصة قوى|info, موافقة الطرفين مطلوبة|warning, آخر تحديث: مارس 2026|warning",,"renew-iqama, renew-work-permit, final-exit-visa",2026-03-18
vehicle-inspection-fahs,إجراء الفحص الدوري للمركبة (فحص),Vehicle periodic inspection (Fahs),الفحص الدوري إلزامي لجميع المركبات في المملكة ومطلوب لتجديد استمارة السيارة. يتم في محطات الفحص المعتمدة.,محطات الفحص الدوري,https://www.mvpi.com.sa,الهيئة السعودية للمواصفات والمقاييس,"Saudi Standards, Metrology and Quality Organization",خدمات المرور,Traffic Services,"محطات الفحص الدوري|info, مطلوب لتجديد الاستمارة|warning, آخر تحديث: مارس 2026|warning",القيادة بدون فحص دوري ساري مخالفة مرورية وتمنع تجديد الاستمارة,"vehicle-registration-renewal, vehicle-ownership-transfer",2026-03-18
vehicle-ownership-transfer,نقل ملكية مركبة عبر أبشر,Transfer vehicle ownership via Absher,تمكّنك هذه الخدمة من نقل ملكية مركبة بين بائع ومشتري إلكترونياً عبر أبشر، دون الحاجة لزيارة إدارة المرور.,أبشر أفراد,https://www.absher.sa,وزارة الداخلية,Ministry of Interior,خدمات المرور,Traffic Services,"أبشر أفراد|info, موافقة الطرفين مطلوبة|warning, آخر تحديث: مارس 2026|warning",,"vehicle-registration-renewal, renew-driving-license",2026-03-18
vehicle-registration-renewal,تجديد استمارة المركبة عبر أبشر,Renew vehicle registration (Istimara) via Absher,تتيح لك هذه الخدمة تجديد رخصة سير المركبة (الاستمارة) إلكترونياً عبر منصة أبشر، بشرط اجتياز الفحص الدوري وتوفر تأمين ساري.,أبشر أفراد,https://www.absher.sa,وزارة الداخلية,Ministry of Interior,خدمات المرور,Traffic Services,"أبشر أفراد|info, يتطلب فحص دوري وتأمين|warning, آخر تحديث: مارس 2026|warning",غرامة التأخير في التجديد تتراوح بين 100-150 ر.س، والقيادة باستمارة منتهية مخالفة مرورية,"renew-driving-license, pay-traffic-fines",2026-03-18
zatca-einvoicing-registration,التسجيل في الفوترة الإلكترونية (فاتورة) عبر هيئة الزكاة,Register for e-invoicing (Fatoorah) via ZATCA,الفوترة الإلكترونية إلزامية لجميع المنشآت المسجلة في ضريبة القيمة المضافة. يجب ربط أنظمة الفوترة مع منصة فاتورة التابعة لهيئة الزكاة.,هيئة الزكاة والضريبة والجمارك,https://zatca.gov.sa,هيئة الزكاة والضريبة والجمارك,"Zakat, Tax and Customs Authority (ZATCA)",خدمات ضريبية,Tax Services,"منصة فاتورة|info, إلزامي لجميع المنشآت|warning, آخر تحديث: مارس 2026|warning","غرامات عدم الامتثال تتراوح بين 5,000 و 50,000 ر.س","zatca-vat-registration, issue-commercial-registration",2026-03-18
zatca-vat-registration,التسجيل في ضريبة القيمة المضافة عبر هيئة الزكاة,Register for VAT via ZATCA,"يجب على كل منشأة تتجاوز إيراداتها السنوية 375,000 ر.س التسجيل في ضريبة القيمة المضافة (15%) لدى هيئة الزكاة والضريبة والجمارك.",هيئة الزكاة والضريبة والجمارك,https://zatca.gov.sa,هيئة الزكاة والضريبة والجمارك,"Zakat, Tax and Customs Authority (ZATCA)",خدمات ضريبية,Tax Services,"هيئة الزكاة والضريبة|info, إلزامي فوق 375,000 ر.س|warning, آخر تحديث: مارس 2026|warning","عدم التسجيل مع تجاوز الحد يعرّض المنشأة لغرامة تصل إلى 10,000 ر.س","issue-commercial-registration, renew-commercial-registration",2026-03-18