slug,title_ar,title_en,description_ar,description_en,portal,portal_url,ministry_ar,ministry_en,category_ar,category_en,tags,penalty_ar,penalty_en,related_slugs,last_updated
vehicle-ownership-transfer,نقل ملكية مركبة عبر أبشر,Transfer vehicle ownership via Absher,تمكّنك هذه الخدمة من نقل ملكية مركبة بين بائع ومشتري إلكترونياً عبر أبشر، دون الحاجة لزيارة إدارة المرور.,"This service enables vehicle ownership transfer between seller and buyer electronically via Absher, without visiting the Traffic Department.",أبشر أفراد,https://www.absher.sa,وزارة الداخلية,Ministry of Interior,خدمات المرور,Traffic Services,"أبشر أفراد|info, موافقة الطرفين مطلوبة|warning, آخر تحديث: مارس 2026|warning",,,"vehicle-registration-renewal, renew-driving-license",########
vehicle-registration-renewal,تجديد استمارة المركبة عبر أبشر,Renew vehicle registration (Istimara) via Absher,تتيح لك هذه الخدمة تجديد رخصة سير المركبة (الاستمارة) إلكترونياً عبر منصة أبشر، بشرط اجتياز الفحص الدوري وتوفر تأمين ساري.,"This service allows you to renew your vehicle registration (Istimara) electronically via Absher, provided you have a valid periodic inspection and active insurance.",أبشر أفراد,https://www.absher.sa,وزارة الداخلية,Ministry of Interior,خدمات المرور,Traffic Services,"أبشر أفراد|info, يتطلب فحص دوري وتأمين|warning, آخر تحديث: مارس 2026|warning",غرامة التأخير في التجديد تتراوح بين 100-150 ر.س، والقيادة باستمارة منتهية مخالفة مرورية,"Late renewal fine ranges from SAR 100-150, and driving with an expired registration is a traffic violation","renew-driving-license, pay-traffic-fines",########
water-connection-nwc,طلب إيصال مياه عبر شركة المياه الوطنية,Request water connection via NWC,تتيح هذه الخدمة طلب إيصال خدمة المياه لعقار جديد أو نقل الحساب إلكترونياً عبر شركة المياه الوطنية.,This service allows you to request water connection for a new property or transfer an account electronically via the National Water Company.,شركة المياه الوطنية (NWC),https://www.nwc.com.sa,شركة المياه الوطنية,National Water Company (NWC),خدمات الإسكان,Housing Services,خدمة إلكترونية|info,,,"electricity-connection-sec, ejar-rental-contract",2026-03-18
zatca-einvoicing-registration,التسجيل في الفوترة الإلكترونية (فاتورة) عبر هيئة الزكاة,Register for e-invoicing (Fatoorah) via ZATCA,الفوترة الإلكترونية إلزامية لجميع المنشآت المسجلة في ضريبة القيمة المضافة. يجب ربط أنظمة الفوترة مع منصة فاتورة التابعة لهيئة الزكاة.,Electronic invoicing is mandatory for all establishments registered for VAT. Invoicing systems must be linked with the ZATCA Fatoora platform.,هيئة الزكاة والضريبة والجمارك,https://zatca.gov.sa,هيئة الزكاة والضريبة والجمارك,"Zakat, Tax and Customs Authority (ZATCA)",خدمات ضريبية,Tax Services,"منصة فاتورة|info, إلزامي لجميع المنشآت|warning, آخر تحديث: مارس 2026|warning","غرامات عدم الامتثال تتراوح بين 5,000 و 50,000 ر.س","Non-compliance fines range from SAR 5,000 to SAR 50,000","zatca-vat-registration, issue-commercial-registration",########
zatca-vat-registration,التسجيل في ضريبة القيمة المضافة عبر هيئة الزكاة,Register for VAT via ZATCA,"يجب على كل منشأة تتجاوز إيراداتها السنوية 375,000 ر.س التسجيل في ضريبة القيمة المضافة (15%) لدى هيئة الزكاة والضريبة والجمارك.","Every establishment with annual revenue exceeding SAR 375,000 must register for Value Added Tax (15%) with the Zakat, Tax and Customs Authority (ZATCA).",هيئة الزكاة والضريبة والجمارك,https://zatca.gov.sa,هيئة الزكاة والضريبة والجمارك,"Zakat, Tax and Customs Authority (ZATCA)",خدمات ضريبية,Tax Services,"هيئة الزكاة والضريبة|info, إلزامي فوق 375|info, 000 ر.س|warning, آخر تحديث: مارس 2026|warning","عدم التسجيل مع تجاوز الحد يعرّض المنشأة لغرامة تصل إلى 10,000 ر.س","Failure to register while exceeding the threshold exposes the establishment to fines up to SAR 10,000","issue-commercial-registration, renew-commercial-registration",########