slug,title_ar,title_en,description_ar,portal,portal_url,ministry_ar,ministry_en,category_ar,category_en,tags,penalty_ar,related_slugs,last_updated
absher-account-registration,تسجيل وتفعيل حساب أبشر,Register and activate Absher account,أبشر هي البوابة الإلكترونية لخدمات وزارة الداخلية. هذا الدليل يشرح كيفية إنشاء حساب جديد وتفعيله خطوة بخطوة.,أبشر,https://www.absher.sa,وزارة الداخلية,Ministry of Interior,خدمات عامة,General Services,"أبشر|info, مطلوب لكل الخدمات|warning, آخر تحديث: مارس 2026|warning",,"register-national-address, renew-iqama",2026-03-18
check-iqama-validity,الاستعلام عن صلاحية الإقامة عبر أبشر,Check Iqama validity via Absher,تتيح لك هذه الخدمة التحقق من تاريخ انتهاء إقامتك أو إقامة أحد مكفوليك إلكترونياً عبر أبشر، لتجنب الغرامات والتأخير.,أبشر أفراد,https://www.absher.sa,وزارة الداخلية,Ministry of Interior,خدمات الجوازات,Passport Services,"أبشر أفراد|info, استعلام فوري|success, آخر تحديث: مارس 2026|warning",,"renew-iqama, dependents-fee-payment, exit-reentry-visa",2026-03-18
check-traffic-violations,الاستعلام عن المخالفات المرورية برقم الهوية,Check traffic violations by ID number,تتيح لك هذه الخدمة الاستعلام عن جميع المخالفات المرورية المسجلة عليك أو على مركباتك، مع تفاصيل كل مخالفة وحالة السداد.,أبشر أفراد / تطبيق المرور,https://www.absher.sa,وزارة الداخلية,Ministry of Interior,خدمات المرور,Traffic Services,"أبشر / تطبيق المرور|info, استعلام فوري|success, آخر تحديث: مارس 2026|warning",,"pay-traffic-fines, traffic-violation-objection, renew-driving-license",2026-03-18
convert-visit-to-iqama,تحويل تأشيرة زيارة إلى إقامة,Convert visit visa to Iqama (residence permit),في بعض الحالات يمكن تحويل تأشيرة الزيارة إلى إقامة عمل أو إقامة مرافق دون الحاجة لمغادرة المملكة والعودة.,أبشر أعمال / قوى,https://www.absher.sa,وزارة الداخلية / وزارة الموارد البشرية,Ministry of Interior / HRSD,خدمات الجوازات,Passport Services,"أبشر أعمال / قوى|info, شروط محددة|warning, آخر تحديث: مارس 2026|warning",,"renew-iqama, family-visit-visa, exit-reentry-visa",2026-03-18
dependents-fee-payment,سداد رسوم المرافقين والتابعين,Pay dependent and companion fees,تُفرض رسوم شهرية على المرافقين والتابعين للمقيمين في المملكة. يمكن سدادها عبر أبشر أو القنوات البنكية.,أبشر أفراد / البنوك,https://www.absher.sa,وزارة الداخلية,Ministry of Interior,خدمات الجوازات,Passport Services,"أبشر / سداد|info, رسوم شهرية|warning, آخر تحديث: مارس 2026|warning",عدم السداد يمنع تجديد الإقامة وإصدار التأشيرات,"renew-iqama, exit-reentry-visa",2026-03-18
ejar-rental-contract,توثيق عقد إيجار إلكتروني عبر إيجار,Register rental contract via Ejar,يجب توثيق جميع عقود الإيجار السكنية والتجارية إلكترونياً عبر منصة إيجار. العقد الموثق مطلوب لإصدار رخص البلدية وفتح حسابات الخدمات.,منصة إيجار,https://www.ejar.sa,وزارة الشؤون البلدية والقروية والإسكان,"Ministry of Municipal, Rural Affairs and Housing",خدمات الإسكان,Housing Services,"منصة إيجار|info, إلزامي لكل عقد إيجار|warning, آخر تحديث: مارس 2026|warning",عقود الإيجار غير الموثقة لا تُقبل في المحاكم ولا تُستخدم لإصدار التراخيص,"issue-municipal-license, register-national-address",2026-03-18
exit-reentry-visa,إصدار تأشيرة خروج وعودة عبر أبشر,Issue exit/re-entry visa via Absher,تتيح لك هذه الخدمة إصدار تأشيرة خروج وعودة لأحد المكفولين أو العمالة المنزلية إلكترونياً، مما يمكّنهم من السفر خارج المملكة والعودة خلال فترة محددة.,أبشر أفراد,https://www.absher.sa,وزارة الداخلية,Ministry of Interior,خدمات الجوازات,Passport Services,"أبشر أفراد|info, إلكترونية بالكامل|success, آخر تحديث: مارس 2026|warning",عدم العودة خلال مدة التأشيرة قد يؤدي لإلغاء الإقامة,"renew-iqama, final-exit-visa, renew-passport-expat",2026-03-18
family-visit-visa,إصدار تأشيرة زيارة عائلية عبر وزارة الخارجية,Issue family visit visa via MOFA,تتيح لك هذه الخدمة تقديم طلب تأشيرة زيارة عائلية لاستقدام أفراد عائلتك من خارج المملكة لزيارة مؤقتة.,منصة التأشيرات الإلكترونية,https://visa.mofa.gov.sa,وزارة الخارجية,Ministry of Foreign Affairs,خدمات التأشيرات,Visa Services,"وزارة الخارجية|info, للمقيمين والمواطنين|success, آخر تحديث: مارس 2026|warning",عدم مغادرة الزائر قبل انتهاء التأشيرة يعرّض الكفيل لغرامة ومنع من إصدار تأشيرات مستقبلية,"exit-reentry-visa, renew-iqama",2026-03-18
final-exit-visa,إصدار تأشيرة خروج نهائي عبر أبشر,Issue final exit visa via Absher,تمكّن هذه الخدمة صاحب العمل من إصدار تأشيرة خروج نهائي لأحد العاملين لديه، وذلك لمغادرة المملكة بشكل نهائي بعد انتهاء العلاقة العمالية.,أبشر أعمال,https://www.absher.sa,وزارة الداخلية,Ministry of Interior,خدمات الجوازات,Passport Services,"أبشر أعمال|info, إلكترونية بالكامل|success, آخر تحديث: مارس 2026|warning",,"renew-iqama, exit-reentry-visa, transfer-sponsorship",2026-03-18
gosi-certificate,إصدار شهادة التأمينات الاجتماعية,Issue GOSI subscription certificate,شهادة التأمينات مطلوبة في كثير من المعاملات الحكومية والبنكية. يمكن إصدارها إلكترونياً عبر بوابة التأمينات أون لاين.,التأمينات أون لاين,https://www.gosi.gov.sa,المؤسسة العامة للتأمينات الاجتماعية,General Organization for Social Insurance (GOSI),خدمات التأمينات,Insurance Services,"التأمينات أون لاين|info, إلكترونية بالكامل|success, آخر تحديث: مارس 2026|warning",,"gosi-register-employee, gosi-retirement-subscription",2026-03-18
gosi-register-employee,تسجيل موظف في التأمينات الاجتماعية عبر أعمال,Register employee in GOSI via Amaal,تتيح هذه الخدمة لأصحاب المنشآت تسجيل موظفيهم الجدد (سعوديين ووافدين) في نظام التأمينات الاجتماعية إلكترونياً عبر بوابة أعمال.,التأمينات أعمال,https://www.gosi.gov.sa,المؤسسة العامة للتأمينات الاجتماعية,General Organization for Social Insurance (GOSI),خدمات التأمينات,Social Insurance Services,"التأمينات أعمال|info, إلزامي لكل موظف|warning, آخر تحديث: مارس 2026|warning","التأخر في التسجيل يعرّض المنشأة لغرامات تصل إلى 10,000 ر.س وقد يؤثر على نطاقات","renew-work-permit, transfer-sponsorship",2026-03-18
gosi-retirement-subscription,الاستعلام عن مدة الاشتراك في التأمينات,Check GOSI subscription period,تتيح لك هذه الخدمة معرفة مدة اشتراكك في التأمينات الاجتماعية والتحقق من تسجيل جهة عملك لك بشكل صحيح.,التأمينات أون لاين,https://www.gosi.gov.sa,المؤسسة العامة للتأمينات الاجتماعية,General Organization for Social Insurance (GOSI),خدمات التأمينات,Insurance Services,"التأمينات أون لاين|info, للموظفين|success, آخر تحديث: مارس 2026|warning",,gosi-register-employee,2026-03-18
hajj-umrah-permit,إصدار تصريح حج أو عمرة عبر نسك,Issue Hajj or Umrah permit via Nusuk,تتيح منصة نسك للمواطنين والمقيمين إصدار تصاريح الحج والعمرة وحجز الخدمات المرتبطة بها إلكترونياً.,منصة نسك,https://www.nusuk.sa,وزارة الحج والعمرة,Ministry of Hajj and Umrah,خدمات الحج والعمرة,Hajj & Umrah Services,"منصة نسك|info, تصريح مطلوب|warning, آخر تحديث: مارس 2026|warning",,"nafath-setup, absher-account-registration",2026-03-18
issue-birth-certificate,تسجيل مولود وإصدار شهادة ميلاد,Register newborn and issue birth certificate,تتيح هذه الخدمة تسجيل المواليد الجدد وإصدار شهادة الميلاد إلكترونياً عبر أبشر خلال 15 يوماً من الولادة.,أبشر أفراد,https://www.absher.sa,وزارة الداخلية,Ministry of Interior,خدمات الأحوال المدنية,Civil Affairs,"أبشر أفراد|info, خلال 15 يوم من الولادة|warning, آخر تحديث: مارس 2026|warning",التأخر عن 15 يوماً يتطلب مراجعة الأحوال المدنية شخصياً,"renew-national-id, absher-account-registration",2026-03-18
issue-commercial-registration,إصدار سجل تجاري عبر المركز السعودي للأعمال,Issue commercial registration via Saudi Business Center,تتيح لك هذه الخدمة إصدار سجل تجاري رئيسي أو فرعي لمنشأتك إلكترونياً عبر المركز السعودي للأعمال، وهي الخطوة الأولى لبدء أي نشاط تجاري في المملكة.,المركز السعودي للأعمال,https://business.sa,وزارة التجارة,Ministry of Commerce,خدمات تجارية,Business Services,"المركز السعودي للأعمال|info, إلكترونية بالكامل|success, آخر تحديث: مارس 2026|warning",عدم تجديد السجل خلال 30 يوماً من انتهائه يعرّض المنشأة لغرامة وشطب,"renew-commercial-registration, issue-municipal-license",2026-03-18
issue-family-card,إصدار بطاقة العائلة (كرت العائلة) عبر أبشر,Issue family card via Absher,بطاقة العائلة وثيقة رسمية تثبت أفراد الأسرة وعلاقتهم. مطلوبة في كثير من المعاملات الحكومية والتعليمية والصحية.,أبشر أفراد,https://www.absher.sa,وزارة الداخلية,Ministry of Interior,خدمات الأحوال المدنية,Civil Affairs,"أبشر أفراد|info, للمواطنين فقط|warning, آخر تحديث: مارس 2026|warning",,"issue-birth-certificate, marriage-contract-najiz, renew-national-id",2026-03-18
issue-municipal-license,إصدار رخصة بلدية (رخصة نشاط) عبر بلدي,Issue municipal license via Balady,الرخصة البلدية مطلوبة لمزاولة أي نشاط تجاري في موقع فعلي. تتيح منصة بلدي إصدارها إلكترونياً.,منصة بلدي,https://balady.gov.sa,وزارة الشؤون البلدية والقروية والإسكان,"Ministry of Municipal, Rural Affairs and Housing",خدمات تجارية,Business Services,"منصة بلدي|info, مطلوبة لكل موقع تجاري|warning, آخر تحديث: مارس 2026|warning",مزاولة نشاط بدون رخصة بلدية تعرّض المنشأة لغرامة وإغلاق,"issue-commercial-registration, renew-commercial-registration",2026-03-18
jadarat-job-search,البحث عن وظيفة عبر منصة جدارات,Search for jobs via Jadarat platform,جدارات هي المنصة الوطنية للتوظيف التي تربط الباحثين عن عمل بفرص القطاعين العام والخاص، وتحل محل منصتي طاقات وجدارة.,منصة جدارات,https://www.jadarat.sa,وزارة الموارد البشرية والتنمية الاجتماعية,Ministry of Human Resources and Social Development,خدمات العمل,Labor Services,"منصة جدارات|info, للباحثين عن عمل|success, آخر تحديث: مارس 2026|warning",,"gosi-retirement-subscription, renew-national-id",2026-03-18
labor-complaint-qiwa,تقديم شكوى عمالية عبر قوى,File labor complaint via Qiwa,تتيح هذه الخدمة للعاملين تقديم شكوى ضد صاحب العمل في حالات مثل: تأخر الرواتب، عدم توفير بيئة عمل آمنة، أو مخالفة شروط العقد.,منصة قوى,https://www.qiwa.sa,وزارة الموارد البشرية والتنمية الاجتماعية,Ministry of Human Resources and Social Development,خدمات العمل,Labor Services,"منصة قوى|info, للعاملين|success, آخر تحديث: مارس 2026|warning",,"transfer-sponsorship, renew-work-permit",2026-03-18
marriage-contract-najiz,توثيق عقد زواج عبر ناجز,Authenticate marriage contract via Najiz,تتيح هذه الخدمة توثيق عقد الزواج إلكترونياً عبر بوابة ناجز التابعة لوزارة العدل، دون الحاجة لزيارة المحكمة.,بوابة ناجز,https://www.najiz.sa,وزارة العدل,Ministry of Justice,خدمات الأحوال المدنية,Civil Affairs,"بوابة ناجز|info, إلكترونية بالكامل|success, آخر تحديث: مارس 2026|warning",,"issue-birth-certificate, renew-national-id",2026-03-18
musaned-domestic-worker-visa,استقدام عمالة منزلية عبر مساند,Recruit domestic worker via Musaned,تتيح منصة مساند لأصحاب العمل استقدام العمالة المنزلية (سائقين، خادمات، مربيات، طباخين) من خارج المملكة بشكل إلكتروني.,منصة مساند,https://www.musaned.com.sa,وزارة الموارد البشرية والتنمية الاجتماعية,Ministry of Human Resources and Social Development,خدمات العمالة المنزلية,Domestic Worker Services,"منصة مساند|info, للمواطنين والمقيمين|success, آخر تحديث: مارس 2026|warning",,"renew-iqama, transfer-sponsorship",2026-03-18
musaned-transfer-domestic-worker,نقل خدمات عمالة منزلية عبر مساند,Transfer domestic worker via Musaned,تتيح هذه الخدمة نقل خدمات عامل منزلي من كفيل إلى آخر إلكترونياً عبر منصة مساند.,منصة مساند,https://www.musaned.com.sa,وزارة الموارد البشرية والتنمية الاجتماعية,Ministry of Human Resources and Social Development,خدمات العمالة المنزلية,Domestic Worker Services,"منصة مساند|info, موافقة الطرفين مطلوبة|warning, آخر تحديث: مارس 2026|warning",,"musaned-domestic-worker-visa, renew-iqama",2026-03-18
nafath-setup,تفعيل تطبيق نفاذ الوطني,Set up Nafath national digital ID,نفاذ هو نظام الهوية الرقمية الوطني المطلوب لتسجيل الدخول إلى معظم المنصات الحكومية والبنكية. هذا الدليل يشرح التفعيل خطوة بخطوة.,تطبيق نفاذ,https://www.iam.gov.sa,هيئة الحكومة الرقمية,Digital Government Authority,خدمات عامة,General Services,"تطبيق نفاذ|info, مطلوب لكل المنصات|warning, آخر تحديث: مارس 2026|warning",,"absher-account-registration, register-national-address",2026-03-18
pay-traffic-fines,الاستعلام عن المخالفات المرورية وسدادها,Check and pay traffic fines,تتيح لك هذه الخدمة الاستعلام عن المخالفات المرورية المسجلة عليك أو على مركباتك وسدادها إلكترونياً عبر أبشر أو تطبيقات البنوك.,أبشر أفراد,https://www.absher.sa,وزارة الداخلية,Ministry of Interior,خدمات المرور,Traffic Services,"أبشر أفراد|info, إلكترونية بالكامل|success, آخر تحديث: مارس 2026|warning",المخالفات غير المسددة تمنع تجديد الإقامة ورخصة القيادة والاستمارة,"renew-driving-license, vehicle-registration-renewal",2026-03-18
power-of-attorney-najiz,إصدار وكالة إلكترونية عبر ناجز,Issue power of attorney via Najiz,تمكّنك هذه الخدمة من إصدار وكالة شرعية إلكترونية (عامة أو خاصة) عبر بوابة ناجز دون الحاجة لزيارة كتابة العدل.,بوابة ناجز,https://www.najiz.sa,وزارة العدل,Ministry of Justice,خدمات عدلية,Justice Services,"بوابة ناجز|info, إلكترونية بالكامل|success, آخر تحديث: مارس 2026|warning",,marriage-contract-najiz,2026-03-18
property-deed-transfer-najiz,نقل ملكية عقار (إفراغ) عبر ناجز,Transfer property ownership via Najiz,تتيح هذه الخدمة نقل ملكية عقار من البائع إلى المشتري إلكترونياً عبر بوابة ناجز، دون الحاجة لزيارة كتابة العدل.,بوابة ناجز,https://www.najiz.sa,وزارة العدل,Ministry of Justice,خدمات عدلية,Justice Services,"بوابة ناجز|info, إلكترونية بالكامل|success, آخر تحديث: مارس 2026|warning",,"power-of-attorney-najiz, ejar-rental-contract",2026-03-18
register-national-address,تسجيل وتحديث العنوان الوطني عبر سبل,Register or update national address via Subol,العنوان الوطني مطلوب لمعظم الخدمات الحكومية والبنكية. تتيح لك هذه الخدمة تسجيل عنوانك أو تحديثه عبر منصة سبل (البريد السعودي سابقاً).,منصة سبل,https://www.spl.com.sa,مؤسسة البريد السعودي (سبل),Saudi Post (SPL / Subol),خدمات عامة,General Services,"منصة سبل|info, مطلوب لمعظم الخدمات|warning, آخر تحديث: مارس 2026|warning",,issue-commercial-registration,2026-03-18
renew-commercial-registration,تجديد السجل التجاري عبر المركز السعودي للأعمال,Renew commercial registration via Saudi Business Center,تتيح لك هذه الخدمة تجديد السجل التجاري لمنشأتك إلكترونياً قبل انتهائه لتجنب الغرامات والشطب.,المركز السعودي للأعمال,https://business.sa,وزارة التجارة,Ministry of Commerce,خدمات تجارية,Business Services,"المركز السعودي للأعمال|info, إلكترونية بالكامل|success, آخر تحديث: مارس 2026|warning","عدم التجديد خلال 30 يوماً من الانتهاء يعرّض المنشأة لغرامة تصل إلى 10,000 ر.س وقد يؤدي للشطب","issue-commercial-registration, issue-municipal-license",2026-03-18
renew-driving-license,تجديد رخصة القيادة عبر أبشر,Renew driving license via Absher,تمكّنك هذه الخدمة من تجديد رخصة القيادة للمواطنين والمقيمين إلكترونياً عبر منصة أبشر دون الحاجة لزيارة إدارة المرور.,أبشر أفراد,https://www.absher.sa,وزارة الداخلية,Ministry of Interior,خدمات المرور,Traffic Services,"أبشر أفراد|info, إلكترونية بالكامل|success, آخر تحديث: مارس 2026|warning",غرامة تأخير التجديد تتراوح بين 100-150 ر.س، والقيادة برخصة منتهية مخالفة مرورية,"pay-traffic-fines, vehicle-registration-renewal",2026-03-18
renew-ejar-contract,تجديد عقد إيجار إلكتروني عبر إيجار,Renew rental contract via Ejar,تتيح هذه الخدمة تجديد عقد الإيجار السكني أو التجاري الموثق إلكترونياً قبل انتهائه عبر منصة إيجار.,منصة إيجار,https://www.ejar.sa,وزارة الشؤون البلدية والقروية والإسكان,"Ministry of Municipal, Rural Affairs and Housing",خدمات الإسكان,Housing Services,"منصة إيجار|info, موافقة الطرفين مطلوبة|warning, آخر تحديث: مارس 2026|warning",,"ejar-rental-contract, register-national-address",2026-03-18
renew-health-insurance,تجديد التأمين الصحي عبر مجلس الضمان,Renew health insurance via CCHI,التأمين الصحي إلزامي لجميع المقيمين وموظفي القطاع الخاص. يمكن التحقق من حالته وتجديده عبر مجلس الضمان الصحي.,مجلس الضمان الصحي,https://www.chi.gov.sa,مجلس الضمان الصحي التعاوني,Council of Cooperative Health Insurance (CCHI),خدمات صحية,Health Services,"مجلس الضمان الصحي|info, إلزامي للمقيمين|warning, آخر تحديث: مارس 2026|warning",عدم وجود تأمين صحي ساري يمنع تجديد الإقامة,"renew-iqama, renew-work-permit",2026-03-18
renew-iqama,تجديد هوية مقيم عبر أبشر,Renew resident identity (Iqama) via Absher,تمكّنك هذه الخدمة من تجديد هوية مقيم (إقامة) لأحد أفراد أسرتك أو العمالة المنزلية إلكترونياً عبر منصة أبشر، دون الحاجة لزيارة الجوازات.,أبشر أفراد / أعمال,https://www.absher.sa,وزارة الداخلية,Ministry of Interior,خدمات الجوازات,Passport Services,"أبشر أفراد / أعمال|info, إلكترونية بالكامل|success, آخر تحديث: مارس 2026|warning","غرامة التأخير: 500 ر.س للمرة الأولى — 1,000 ر.س للتكرار — الإبعاد للمرة الثالثة","transfer-sponsorship, issue-exit-reentry-visa, renew-work-permit",2026-03-18
renew-national-id,تجديد الهوية الوطنية عبر أبشر,Renew national ID (Hawiyya) via Absher,تتيح لك هذه الخدمة تجديد بطاقة الهوية الوطنية السعودية إلكترونياً عبر منصة أبشر، وتوصيلها لعنوانك الوطني.,أبشر أفراد,https://www.absher.sa,وزارة الداخلية,Ministry of Interior,خدمات الأحوال المدنية,Civil Affairs,"أبشر أفراد|info, للمواطنين فقط|warning, آخر تحديث: مارس 2026|warning",غرامة تأخير تجديد الهوية تصل إلى 100 ر.س,"renew-saudi-passport, register-national-address",2026-03-18
renew-saudi-passport,إصدار وتجديد جواز السفر السعودي عبر أبشر,Issue or renew Saudi passport via Absher,تمكّنك هذه الخدمة من إصدار جواز سفر سعودي جديد أو تجديد جواز منتهي إلكترونياً عبر منصة أبشر، مع إمكانية توصيله لعنوانك الوطني.,أبشر أفراد,https://www.absher.sa,وزارة الداخلية,Ministry of Interior,خدمات الجوازات,Passport Services,"أبشر أفراد|info, للمواطنين فقط|warning, آخر تحديث: مارس 2026|warning",,"renew-iqama, exit-reentry-visa",2026-03-18
renew-work-permit,إصدار وتجديد رخصة عمل عبر قوى,Issue or renew work permit via Qiwa,تتيح هذه الخدمة لأصحاب المنشآت إصدار أو تجديد رخص العمل للعمالة الوافدة إلكترونياً عبر منصة قوى، وهي مطلوبة لتجديد الإقامة.,منصة قوى,https://www.qiwa.sa,وزارة الموارد البشرية والتنمية الاجتماعية,Ministry of Human Resources and Social Development,خدمات العمل,Labor Services,"منصة قوى|info, مطلوبة لتجديد الإقامة|warning, آخر تحديث: مارس 2026|warning",رخصة العمل المنتهية تمنع تجديد الإقامة وقد تؤثر على نطاقات المنشأة,"renew-iqama, transfer-sponsorship",2026-03-18
